{
  "goal": "5-day cultural trip to Japan",
  "plan": [
    {
      "step": "find_flights",
      "result": "{\"offers\": [{\"airline\": \"Japan Airlines\", \"price\": 850.0, \"depart_time\": \"2023-08-15T08:00\", \"arrive_time\": \"2023-08-15T20:00\"}, {\"airline\": \"All Nippon Airways\", \"price\": 820.0, \"depart_time\": \"2023-08-15T09:30\", \"arrive_time\": \"2023-08-15T21:30\"}]}"
    },
    {
      "step": "find_hotels",
      "result": "{\"hotels\": [{\"name\": \"Hotel Sakura (Shinjuku)\", \"address\": \"Shinjuku, Tokyo\", \"price_per_night\": 150.0, \"rating\": 4.2}, {\"name\": \"Kyoto Palace Inn\", \"address\": \"Gion, Kyoto\", \"price_per_night\": 180.0, \"rating\": 4.5}, {\"name\": \"Osaka Riverside Hotel\", \"address\": \"Kita, Osaka\", \"price_per_night\": 120.0, \"rating\": 4.0}]}"
    }
  ],
  "summary": "Here is a summary of the task results:\n\nFlights:\n1. Japan Airlines: Price - $850.0, Departure Time - 2023-08-15T08:00, Arrival Time - 2023-08-15T20:00\n2. All Nippon Airways: Price - $820.0, Departure Time - 2023-08-15T09:30, Arrival Time - 2023-08-15T21:30\n\nHotels:\n1. Hotel Sakura (Shinjuku): Price per night - $150.0, Rating - 4.2, Address - Shinjuku, Tokyo\n2. Kyoto Palace Inn: Price per night - $180.0, Rating - 4.5, Address - Gion, Kyoto\n3. Osaka Riverside Hotel: Price per night - $120.0, Rating - 4.0, Address - Kita, Osaka\n\nLet me know if you need any more information or assistance with planning your trip.",
  "timestamp": "2025-06-04T14:12:33.863172"
}